{
  "schema_version": "scandoc-counter-symbol/0.1",
  "stub_id": "cs-synthetic-001",
  "source_modality": "synthetic",
  "parent_commitment": null,
  "sentinel_reference": null,
  "logical_tick": 0,
  "timestamp_utc": null,
  "residual_type": "unresolved",
  "residual_vector": [
    0.25,
    -0.5,
    0.125
  ],
  "evidence_status": "UNVERIFIED",
  "topology_commitment": "synthetic-topology",
  "related_stub_ids": [],
  "missing_measurements": [],
  "reserved_future_fields": [],
  "live_gate": "CLOSED",
  "sphere_writes": false,
  "commitment_fields": [
    "schema_version",
    "stub_id",
    "source_modality",
    "parent_commitment",
    "sentinel_reference",
    "logical_tick",
    "timestamp_utc",
    "residual_type",
    "residual_vector",
    "evidence_status",
    "topology_commitment",
    "related_stub_ids",
    "missing_measurements",
    "reserved_future_fields",
    "live_gate",
    "sphere_writes"
  ],
  "commitment": "e23237b762eea315071398296f0df00cb6c20702f1f233216e46869c2bde91aa9aa127296a5ecf1c53891b0ad4b377b03606c35a2f3715e1e4572754b3b41428"
}
